{
  "$schema": "https://json-schema.org/draft/2020-12/schema",
  "$id": "https://schemas.agentark.dev/problem-detail/v1.json",
  "title": "AgentArk Problem Detail v1",
  "description": "与 RFC 9457 兼容的 AgentArk 公共错误信封。",
  "type": "object",
  "additionalProperties": false,
  "required": ["type", "title", "status", "code"],
  "properties": {
    "type": { "description": "标识问题类型及其语义文档的 URI。", "type": "string", "format": "uri", "maxLength": 2048 },
    "title": { "description": "面向调用方的稳定问题标题。", "type": "string", "minLength": 1, "maxLength": 256 },
    "status": { "description": "本次问题对应的 HTTP 4xx 或 5xx 状态码。", "type": "integer", "minimum": 400, "maximum": 599 },
    "detail": { "description": "面向本次问题实例的可读详情，不得包含敏感信息。", "type": "string", "minLength": 1, "maxLength": 4096 },
    "instance": { "description": "标识本次具体问题实例的 URI 引用。", "type": "string", "format": "uri-reference", "maxLength": 2048 },
    "code": {
      "description": "遵循 ARK-服务-资源-五位数字协议的稳定领域错误码。",
      "type": "string",
      "pattern": "^ARK-[A-Z][A-Z0-9_]*-[A-Z][A-Z0-9_]*-[0-9]{5}$"
    },
    "requestId": { "description": "边缘层分配的请求关联标识。", "type": "string", "minLength": 1, "maxLength": 128 },
    "traceId": { "description": "用于跨服务追踪的 16 字节小写十六进制标识。", "type": "string", "pattern": "^[0-9a-f]{32}$" },
    "violations": {
      "description": "请求字段或领域约束的逐项违规详情。",
      "type": "array",
      "maxItems": 1000,
      "items": { "$ref": "#/$defs/violation" }
    }
  },
  "$defs": {
    "violation": {
      "description": "单个字段或领域路径上的稳定违规信息。",
      "type": "object",
      "additionalProperties": false,
      "required": ["path", "code", "message"],
      "properties": {
        "path": { "description": "发生违规的字段或领域属性路径。", "type": "string", "minLength": 1, "maxLength": 512 },
        "code": { "description": "可供调用方稳定处理的机器违规码。", "type": "string", "pattern": "^[A-Z][A-Z0-9_]{0,127}$" },
        "message": { "description": "不含敏感信息的可读违规说明。", "type": "string", "minLength": 1, "maxLength": 2048 }
      }
    }
  }
}
